;
lead up the garden path ;Vrb phrs. To mislead. {Informal}
leak ;"Noun. An act of urination. E.g. ""Hold on a minute, I need to take a leak."""
lean;Adj. Intoxicated with alcohol or drugs. [Mainly London use]
leathered ;Adj. Drunk.
leathering ;Noun. A beating. Originates from the use of a leather belt or thong to beat someone. Derived from the verb - to leather.
leave it out!;Exclam. Stop it! Stop doing that!
lech ;Verb. To sexually lust. Also spelt letch. {Informal}
;Noun. Someone who is lecherous and lustful. Derog.
leck;Verb.See 'laik'.
lecky ;"Noun. Electricity. Also 'lecko'. E.g. ""I'm afraid we can't invite you back, we've had the lecky cut off."""
ledge;"Noun. Abb. of legend or legendary. Also lege. E.g.""Will Smith? He's a ledge."""
Lee Marvin;Adj. Starvin' (starving), hungry. Rhyming slang. Lee Marvin, an American film and television actor.
leftfield ;Adj. Taking an unconventional view or stance. [Orig. U.S.]
left footer;Noun. A Catholic. Derog.
lefty ;Noun. A socialist. Derog.
legend ;"Noun. An exceptional or outstanding person. E.g.""Tom's a real legend! Winning £10,000 on the horses."""
leg it ;"Verb. To run hurriedly. E.g.""We heard the police sirens and legged it."""
legit ;Adj. Abb. of legitimate.
legless ;Adj. Very drunk. Obvious derivation from the consequences of excessive alcohol and being unable to walk.
leg opener;Noun. Anything that helps or has the reaction of making a female more sexually amenable.
leg-over ;"Noun. Sexual intercourse, usually in the phrase 'get one's leg over'. E.g.""Did you get your leg-over with that girl last night?"""
lemon;Noun. 1. A fool, idiot, objectionable person.
;2. A lump of excrement. Rhyming slang on lemon curd, meaning 'turd'. [1960s]
;3. A lesbian. Derog.
lemon and lime;Noun. Time. Rhyming slang.
lemon squeezy;Adj. Easy, simple. Either from the rhyming slang or the juvenile rhyme - easy peasy, lemon squeezy.
length ;Noun. Euphemism for the penis. See 'slip (someone) a length'.
Leo ;Noun. An all day drinking spree. From the rhyming slang on Leo Sayer meaning all dayer. Leo Sayer, a British pop musician popular in the mid 1970s. 
les-be friends ;Noun. A lesbian or lesbians. A pun on let's be friends. Also lez-be friends. Derog.
lesbo;Noun. A lesbian.
let down ;"Noun. A disappointment. E.g.""Having our holiday cancelled due to the pandemic was a huge let down."""
let off ;"Verb. To break wind, to 'fart'. A shortening of let off wind. E.g.""Ew, that's disgusting! Who's let off?"""
let one go;"Verb. To break wind, to fart. E.g.""Sorry chaps, I've just let one go?"""
let (one) rip;Verb. To break wind, to fart.
let the dog see the rabbit;Phrs. Move out of the way so that I can see. [Northern use]
lettuce;Noun. The female genitals.
lettuce licker;Noun. A lesbian. See 'lettuce'. Derog.
lezzer;Noun. A lesbian.
lick arse;Verb. To act obsequiously, to be a sycophant.
;Noun. A sycophant.
lickety-split;Adv. Fast, speedily. [Orig. U.S.]
lickle ;Adj. Small. A lazy or childlike corruption of the word little.
lick (out);Verb. To perform cunnilingus.
lick (someone's) arse;"Verb. To act like a sycophant. E.g.""Licking the manager's arse might get you a promotion, but you'll not gain many friends."""
lick up ;"Verb. To fawn, to be obsequious. E.g.""She licked up to the teacher and got a grade A in her English language test."""
life of Riley ;"Noun. The good life. E.g.""Ever since they won the lottery and have stopping working they've been living the life of Riley."""
lift;"Verb. To steal. E.g.""She lifted some food from the supermarket so her child could eat."""
ligger;Noun. A 'freeloader', a taker of things that are freely available, especially in the world of show business or music.
lights are on but no-one's home ;Phrs. Of a person, that they are alive but not in touch with reality. A catch-phrase cast at a person who lacks commonsense or whose attention has wandered.
like;"Adv. In conversation, used to qualify or re-enforce the preceding statement, such as kind of, as it were, so to speak. E.g.""We had a great night out clubbing, like."" {Informal}"
like a bastard;"Phrs. In a hurried or agitated state. E.g.""I raced around the shops like a bastard, looking for a birthday present."""
like a blue arsed fly ;"Phrs. Hurriedly and frantically. E.g.""God, I'm so exhausted, I've been racing around all day like a blue-arsed fly."""
like a dead heat in a zeppelin race;Phrs. Of a woman, having large breasts. Cf. 'zeppelins'.
like a dog with two dicks;"Phrs. 1. Sexually promiscuous, with the implication that the person cannot control their sexual appetite, having animal urges. Applied to males. E.g.""Did you see Bob ogling that woman's breasts? He was all over her like a dog with two dicks."""
;2. Sexually excitable or excited.
;3. Over excited.
like a fart in a colander;Phrs. 1. Useless. In expressions such as, about as much use as a fart in a colander.
;"2. Confused. E.g.""You're like a fart in a colander, not knowing which hole to come out of."""
like a pig in shit;Phrs. Happy, contented.
like a rat up a drainpipe;Phrs. Very quickly.
like a row of bombed houses;Phrs. Of teeth, crooked, irregular, not in a good state.
like a sack of spuds;"Phrs. Easily, quickly, heavily. Usually describing a physical fall. E.g.""I hardly touched him and he went down like a sack of spuds."""
like a spare prick at a wedding;"Phrs. Totally useless, unwanted, and with a hint of embarrassment for being in that predicament. E.g.""There I was, waiting for my date at the entrance of this packed restaurant on Valentines Day, like a spare prick at a wedding."""
like flies on shit;"Phrs. Used as emphasis to imply great numbers and enthusiasm, usually with depreciative undertones. E.g.""She'd go into a bar and all the men would be all over her like flies on shit."""
like fuck (!);"Adj/adv. Intensely, greatly, very much, speedily. E.g.""We went at the decorating like fuck, and finished the whole house in 2 days."""
;"Exclam. An exclamation of denial. E.g.""Like fuck! I'm not running naked through the town centre."""
like it or lump it;Phrs. An ultimatum - either like it or just put up with it, but whatever, there is no choice. See 'lump it'.
likely lad;Noun. A smart, self-confident, often cheeky young man. [Mainly Northern use] {Informal}
like nobody's business ;Phrs. Totally, quickly, very well.
like shit off a shovel ;Phrs. Very quickly.
like shit off a stick;Phrs. Quickly.
like something not right;"Phrs. Added to the end of an action to express that it was extreme in some context. E.g.""It was raining like something not right, and within an hour the house was flooded."""
like the clappers;"Phrs. Very quickly, very hard. E.g.""We ran like the clappers."" {Informal}"
Lilly (Law);Noun. The police. From Polari slang Lilly Law.
lils ;Noun. Breasts.
Limey;Noun. An English person. Derived from the habit, on long journeys, of supplying lime juice to English sailors as a preventative against scurvy. [Orig. Aust. 1880s]
limp-dick;Noun. A weakling, an ineffectual person.
;"Adj. Weak, ineffectual, inadequate. E.g.""Yet another limp-dick performance against the worse team in the division."""
limp-wristed ;Adj. Feeble, effeminate, usually applied to males, and often implying homosexuality.
line ;Noun. A quantity of powdered drug, such as cocaine, that is chopped and presented as a line in order to be snorted.
lingo ;Noun. A language, often unintelligable for the uninitiated, that is used by a particular group of people, or about a particular subject. Also used to denote a foreign language, usually one that isn't understood. {Informal}
Lionels;Noun. Flaired trousers/jeans. Rhyming slang on Lionel Blair's, meaning flairs. From the British dancer/entertainer, Lionel Blair. [1970s]
lip ;Noun. Verbal impudence, cheek.
lippy ;Adj. Impertinent, mouthy, cheeky. {Informal}
;Noun. Lipstick.
lips ;Noun. The labias.
lipstick;Noun. A dog's penis, when slightly aroused and it's tip showing.
lipstick lesbian ;Noun. A lesbian who prefers to wear make-up and look conventionally feminine, as opposed to a 'bull-dyke' or 'diesel-dyke'.
liquid lunch ;Noun. A lunch break comprising of alcohol instead of food.
little boy's/girl's room ;"Noun. Euphemisms for a lavatory, bathroom or toilet. E.g.""Could someone direct me to the little girls room, I'm desperate."""
little fella;"Noun. Affectionate term for an ectasy pill. E.g.""We cant have a good night tonight until we get some little fellas."""
little man in a boat ;Noun. A euphemism for the clitoris. From its appearance.
littles;Noun. Pills, or more commonly ectasy pills.
little swimmers;Noun. Sperm.
little 'un;Noun. A little one. Usually referring to young children.
livener;Noun. A drink used as a pick-me-up, often the first drink of the day.
load ;"Noun. The quantity of semen that is usually ejaculated. E.g.""She was so horny I shot my load just looking at her."" See 'shoot one's load'."
loaded ;Adj. 1. Drunk, or drugged up.
;2. Wealthy.
load of crap ;"Noun. Utter nonsense, complete rubbish, worthless. The prefixal element load of is regularly placed before nouns as an intensifier in perjorative expressions such as a load of shit, a load of bollocks, a load of tosh. E.g.""That film we went to see was a load of crap."""
load of old bollocks;Noun. Utter nonsense, complete rubbish. See 'load of crap'.
load of old crap;Noun. See 'load of crap'.
loaf;Noun. Head. Rhyming slang on loaf of bread. See 'use one's loaf'.
lob;"Verb. 1. To discard, to throw away. E.g.""It's no use, it's broken, just lob it."""
;"2. To pass, to give. E.g.""Will you lob me the salt and pepper?"""
lob on ;Noun. An erect penis.
lobster ;Noun. A very sunburnt person. Derog.
(the) local ;"Noun. One's local drinking establishment, public house, bar, that is usually located nearest to ones home or work. E.g.""I usually pop down to my local for some lunch at the weekends."" {Informal}"
lock-in ;Noun. The time after a public house has closed when a chosen few are offered the chance to buy more drinks. An illegal activity, hence the locking of doors.
log ;Noun. A lump of excrement. From its vague similarity to a to a sawn tree trunk.
lolly ;Noun. Money.
lombard;Noun/Acronym. A wealthy but objectionable person. Stands for loads of money but a right dickhead, or lots of money but a right dickhead, or equivalent.
long bacon ;Noun. A derisive gesture that involves thumbing one's nose whilst waggling one's extended fingers. Used in phrases such as make/pull the long bacon.
long-hair ;Noun. A hippy.
long mackintosh brigade;Noun. Collectively, perverts or those who indecently expose themselves, as traditionally seen wearing long raincoats (mackintoshes) to hide their sexual intentions. Cf. 'dirty mackintosh brigade'.
long streak of piss ;Noun. A tall thin person. Derog.
long time no see ;Phrs. It's been a while since we last met. Used as a greeting. {Informal}
loo ;Noun. A lavatory, a toilet. [Late 1800s] {Informal}
lookah ;Noun. Money. It is derived from lucre, a derogatory term for profit or gain. Also spelt luka.
look at someone gone out;"Phrs. Expressed at a person who responds blankly at something. E.g.""Look at you gone out! What's up? Haven't you understood a word I've been saying."" [Midlands/South Yorkshire use?]"
looker ;Noun. An attractive person.
look like death warmed up ;"Vrb phrs. To look very pale and sickly. E.g.""She had a terrible hangover and looked like death warmed up."""
look like something the cat brought in ;Vrb phrs. To look scruffy, unkempt, or in a physical mess.
look like you've been dragged through a hedge backwards;"Vrb phrs. To have very unkempt hair. E.g.""When was the last time he ran a comb through his hair? It looked like he'd been dragged through a hedge backwards."""
looksee ;"Noun. A look, a glance. Also looksy. E.g.""Have a looksy at this brochure and tell me which holiday appeals to you."""
loon;Noun. An insane person. Abb. of lunatic. Derog.
loony ;Noun. An insane person. From lunatic. Derog.
;Adj. Crazy.
loony-bin ;Noun. Mental institution, a lunatic asylum.
loopy ;Adj. Mad, insane.
loppy;Adj. Dirty, filthy. [Yorks use]
Lord Muck ;Noun. A pompous, conceited male who considers themselves above their peers. Cf. 'Lady Muck'.
lose it ;Verb. To become confused or out of control.
lose one's bottle ;Vrb phrs. To lose courage. Cf. 'bottle' and 'bottle it'.
lose one's marbles ;Vrb phrs. To go crazy, to lose control.
lose one's rag ;"Vrb phrs. To lose control in a fit of fury, to be very angry. E.g.""You should keep out of Jill's way when she loses her rag; she's got a lethal right hook."""
lose the plot ;Vrb phrs. Be confused, to go off direction, whether with conversation or in one's activities.
lot ;"Noun. A person or group of people with a particular character, often modified with an depreciative adj. such as bad lot, boring lot, noisy lot etc. Also used as a form of address for a group of people, in you lot. E.g.""Are you lot ready to set off? We've got a long way to go."" {Informal}"
lounge lizard ;Noun. 1. An idle frequenter of fashionable bars. Old fashioned. {Informal}
;2. Someone who is very lazy and unenergetic.
louse;Verb. To finish a job or task. [Scottish use]
love ;Noun. A friendly term of address. {Informal}
love a duck! ;Exclam. An exclamation of surprise.
love custard;Noun. Semen.
loved up;Adj. 1. In love.
;2. High on drugs and feeling intimate and empathetic, usually on MDMA.
love handles;Noun. An area and build up of fat on a person's waistline.
love length;Noun. The penis.
lovely-jubbly! ;Exclam. Excellent! Great! A jocular expression popularized in the 1990s by the cockney character Delboy, in the British sit-com Only Fools and Horses. Originally from a 1950s advertisement for an ice lolly, by the name of Jubbly.
love muscle;Noun. The penis.
love piss;Noun. Semen.
lover boy;Noun. 1. A lover, an attractive man.
;2. A friendly term of address.
love rod;Noun. The penis.
love spuds;Noun. Testicles.
low-life ;"Noun. Contemptible and despised person or persons, often with criminal leanings. E.g.""I'm not going in that bar, it's full of low-life and I value my own life."""
lug;Noun. Ear. {Informal}
lug-hole ;Noun. The ear hole. Also lughole. See 'lug'.
luka;Noun. See 'lookah'.
lumber;"Verb. To burden. E.g.""What am I, a doctor? Don't lumber me with all your medical problems, go to the health centre."" {Informal}"
lummox ;Noun. A clumsy, stupid person. Often used affectionately.
lump it ;"Verb. To suffer or endure something. See 'like it or lump it'. E.g.""You'll just have to lump it; being a parent isn't easy and you'll always have no time to yourself."""
lumpy jumper;Noun. A female, specifically one in the military. [Military use]
lunchbox ;Noun. Male genitals.
lungs;Noun. Women's breasts.
lurgy;Noun. Any unspecified or indeterminate illness. Jocular use. Also lurgee and lurgi. See '(the) dreaded lurgy'. {Informal}
lurve;Noun/Verb. Love. Humourous and intentional mispronunciation to suggest more passion and lust.
lush;Adj. Excellent, appealing, attractive.
;Noun. A habitual, heavy drinker of alcohol. Derog.
lusty ;Adj. Sexually excited. Derived from the s.e. lust and grammatically correct adjective lustful.
luvvie;Noun. 1. An actor or actress, especially one with a flamboyant and affected theatrical manner. Also luvvy. Often derog. {Informal}
;2. A form of address. From lovey. {Informal}
luzz ;"Verb. To pass or throw. E.g.""Will you luzz me that pen and paper, please?"" Cf. 'lazz'. [S.E. England use]"
lychees;Noun. Testicles.
Maccy D's;Noun. McDonalds, the fast food company. Also occasionally Macky D's. [Orig. U.S.]
Mackem;Noun. A person from Sunderland. As used by Geordies (those born in Newcastle upon Tyne), from the vocal pronunciation of those from Sunderland. Also spelt Makem. Occasionally derog.
mackintosh brigade;Noun. Collectively, perverts, or those who indecently expose themselves. Cf. 'dirty mackintosh brigade' and 'long mackintosh brigade'.
mad aleck ;Noun. A person acting crazily and energetically. Usually heard applied to overenergetic children by parents or guardians. Also spelt mad alec and mad alick.
Madam Palm and her five sisters ;"Noun. The hand when used for masturbation. Also Madam Palm and her five daughters. E.g.""Tonight I'm going to please myself and spend some quality time with Madame palm and her five sisters."" Cf. 'Mary palm and her five sisters', 'Mrs Palm and her five sisters' and 'Rosie Palm and her five sisters'."
mad as a bag of ferrets;Phrs. Very unusual, crazy, furious.
mad as a box of frogs;Phrs. Of a situation or person, totally crazy.
Madchester ;Noun. The original alternative pseudonym for Manchester from the late 1980s, early 1990s, with the proliferation of the youth scene focused around the bands called Happy Mondays and The Stone Roses. Coined by two 'Geordies', Phil Shotton and Keith Jobling, resident in Manchester at the time. Cf. 'Gaychester' and 'Gunchester'.
made up ;"Adj. Happy, very satisfied, thrilled. E.g.""I'm made up on hearing your good news, when's the baby due?"" [North-west use]"
mad for it ;"Phrs. Enthusiastic, eager. A nationally used term since the mid 1990s, originating from Manchester. E.g.""He was mad for it all night and we couldn't get him to stop dancing until 7am in the morning."""
madhead;Noun. A crazy person, a mentally unstable person.
mad hot ;Adj. Extremely hot. [Manchester use]
mad keen ;Adj. Very enthusiastic. [Manchester use]
mafted;Adj. Of a person, hot and bothered, oppressed by heat. Also mafting, usually pronounced maftin', relating to hot and humid weather. [N.E./Yorkshire use]
mafting;"Adj. Of weather, hot and humid. E.g.""Oh God! It's maftin'. Can we go swimming today."" [Northern use]"
maggot;Noun. 1. A despicable, devious or obsequious person.
;2. A small penis.
magic (!) ;Adj./Exclam. Excellent. Often heard as an exclamation of satisfaction. {Informal}.
magic mushroom ;Noun. Any mushroom with hallucinogenic properties, particularly one containing psilocybin, such as the liberty cap. {Informal}.
magic sponge;Noun. The curative sponge employed by physios when assisting injured sports competitors. The sponge apparently dispels symptoms on its application to an injured bodypart, as if by magic! Its magical qualities brings into question whether the sports contestant was actually injured at all.
Mahatma (Ghandhi) ;Noun. 1. Shandy. Rhyming slang. Mahatma Ghandi, Indian anti-colonial nationalist, who employed nonviolent resistance to lead the successful campaign for India's independence from British rule.
;2. Brandy. Rhyming slang.
mahusive;Adj. Immense, extremely sizable, of great size. Also mahoosive. Probably from massive.
make a (complete/total) bollocks of something;"Vrb phrs. To make a mess of something, to make a mistake. Also make a balls of something. E.g.""I don't think the job's mine, I made a total bollocks of my interview."""
make a move on someone;Vrb phrs. To approach and chat to a person with the objective of establishing a physical and sexual relationship.
make an arse of oneself/someone;"Vrb phrs. To make someone/oneself look foolish or ridiculous. E.g.""You made a complete arse of yourself on the dancefloor."""
make an arse of something;"Vrb phrs. To make a mess of something, to fail at a task. E.g.""I made a complete arse of my job interview."""
make a row;"Vrb phrs. To make a loud, unpleasant noise. E.g.""I've got such a headache, the kids have being making a row all afternoon."" See 'row'. {Informal}"
make it snappy(!);"Vrb phrs. To hurry up, to do it quickly. E.g.""Steve, the film starts in 5 minutes, so if you are going to wash your hair you better make it snappy."""
;Exclam. Hurry up!
make mincemeat of (someone) ;Vrb phrs. To beat up thoroughly, to utterly defeat.
make tracks;"Verb. To begin a journey. E.g.""OK, it's 8.30 and we've got to get to London by midday, let's make tracks."""
make whoopie;"Vrb phrs. To have sexual intercourse. E.g.""I've been kept awake all night by the foxes making whoopie outside in the garden."""
malarkey;Noun. Nonsense, foolishness. Also malarky. [Orig U.S.]
mam ;Noun. Mother. A less common variation on mum. [Northern use]
mamil;Noun/Acronym. Middle Aged Man In Lycra. Referring to older men who try to look like professional cyclists by wearing tight fitting, lycra sportswear whilst enjoying their hobby of cycling. Derog.
man alive!;Exclam. Expressing surprise, frustration or anger. {Informal}
manashee;Noun. A woman. Female equivalent of 'gadge'. Also manishee. [Scottish /North-east use]
man boobs;Noun. Male breasts. Cf. 'moobs', 'man tits'.
Manc ;Noun. A person from Manchester, England. Abb. of Mancunian.
mandem ;Noun. A group of male friends, a gang, more generally men. [Orig. Black use. Mid 2000s]
M and S ;Noun. The nickname for Marks and Spencers. Cf. 'Marks and Sparks'.
man-fat ;Noun. Semen. Cf. 'man gravy'.
man gravy;Noun. Semen. Cf. 'man-fat' and 'baby gravy'.
man in a boat;Noun. The clitoris. Cf. 'little man in a boat'.
manky ;Adj. 1. Scruffy, dirty, distasteful, disgusting.
;"2. Poorly, unwell. E.g.""I'm not coming into work, I feel a bit manky."""
manmuck;Noun. Semen.
manor ;Noun. The home district felt to belong to a person or gang.
man tits;Noun. Male breasts.
man whore;Noun. A sexually promiscuous male. Derog.
map of Tassie;Noun. The vagina, inclusive of pubic hair. From the similarity of the external female genitals to Tasmania. Popularized in the UK by the comic Viz. [Orig. Aust. 1990s]
mard ;Noun. 1. A weak willed person, a softie. [Northern use]
;2. A bad mood or temper. [Northern /Midlands use]
mardarse ;Noun. 1. A weak willed person, a softie. [Midlands /Northern use]
;2. An angry, grumpy or moody person. [Midlands /Northern use]
mardy ;Noun. Someone who is easily upset, scared, or moans incessantly. [Northern /Midlands use]{Informal}
;Adj. In the manner of someone who is a 'mardy', see noun.
mare ;"Noun. 1. A woman. E.g.""You silly mare! Why did you do that?"" Derog."
;"2. A terrible situation. Abb. of nightmare. E.g.""We had a mare of a journey and got stuck in the traffic jams on the M25."""
Marks and Sparks ;Noun. Marks and Spencers, the department store. Also shortened to just Marks and 'M and S'.
marmite miner;Noun. A homosexual male. Marmite is a yeast extract spread. Derog.
marmite motorway;Noun. The anus. The expression, the British equivalent of the U.S. slang hershey highway, can be heard expressed in phrases such as up the marmite motorway, meaning up the anus.
marra ;Noun. A mate, friend, 'pal'. [Cumbria /North-east use]
Mars bar ;"Noun. A scar. Rhyming slang. E.g.""He was a really sensitive lad, despite that Mars bar making him look mean."""
Mary Jane;Noun. Marijuana. [Orig. U.S.]
Mary palm and her five sisters;Noun. The hand when employed as a tool for masturbation. Cf. 'madam palm and her five sisters' and 'rosie palm and her five sisters'.
mash;Verb. To brew a cup of tea. {Informal}
mashed ;Verb. Utterly intoxicated by drink or drugs to the extent of being in a mess and unable to function normally.
massive;Noun. A group of people closely united by community and social interests and usually defined by geographical area, e.g. Moss Side Massive. [Orig W.I./U.K.?]
mate;Noun. 1. A friend. {Informal}
;2. A form of address. {Informal}
matey;Noun. A form of address for a friend or companion. {Informal}
;Adj. Friendly, sociable, affable. {Informal}
mattress muncher;Noun. A homosexual male. Derog.
maungy;Adj. Sullen, moody, peevish. [Yorkshire use/Dialect]
mawther;Noun. A young woman. [Norfolk use/ Dialect]
mazed;Adj. Mad, insane. [Devon use/ Dialect?]
meat ;Noun. General term for the male or female genitalia.
;"2. The most important or substantial part of subject, situation or story. E.g.""The meat of the story was in the first chapter when the scene was set."" {Informal}"
meat and two veg ;Noun. The male genitals.
meat-head ;Noun. A stupid person, often with the implication that they have more brawn than brains. Also meathead. Derog.
meat injection;Noun. An act of sexual intercourse.
meat market ;Noun. A place or event where the objective of a sizeable number of those frequenting is to find sexual partners. Often used with regard to nightclubs.
meat wagon;Noun. 1. A police van.
;2. An ambulance.
me duck;Noun. A form of address. Actually my duck. [Midlands use]
mee maw;Verb. To pull faces. From the exagerrated expressions made on the faces of conversing mill workers, in an attempt to make themselves understood over the din of machinery. [Lancashire use. 1900s?]
meff ;Noun. A scruffy, unkempt person, and consequently an objectionable person. [Liverpool use]
mega ;Adj. Fantastic, wonderful. [Orig. U.S. 1960s]
megabucks ;Noun. A huge quantity of money. The term is used despite the expression 'bucks' (money) remaining firmly an Americanism. [Orig. U.S.]
meh (!) ;Exclam. Used to express indifference or disinterest. [Orig. U.S. Early 1990s]
;"Adj. Mediocre, boring, unimpressive. E.g.""Hmmm, I think the critics got it wrong, I thought the movie was a bit meh."" [Orig. U.S.]"
melons ;Noun. Breasts, typically large ones.
melt ;Noun. A weakling, an emotionally soft person. [Mid 2010s?]
melvin;Noun. When one's trousers become caught up between one's buttocks.
member ;Noun. The penis. Assumed to be from the latin membrum virile.
mental;Adj. Insane, crazy. {Informal}
mentalist;Noun. A crazy person, a mental case. Derog. [Orig. U.S.?]
merchant (banker);Noun. A contemptible person. Rhyming slang, meaning 'wanker'.
merk;Verb. 1. To beat up, thrash, or murder.
;"2. To beat or thrash competitively. E.g.""We got merked in the semi-finals of the cup."""
merkin;Noun. An American. A pun on the word American sounding similar to a merkin. From the s.e. merkin, a pubic wig. Derog.
Mersey trout;Noun. A lump of faeces. From when the River Mersey was very unclean and poluted. [North-west use]
messages;Noun. Groceries, usually heard in do the messages, meaning buy the groceries. [Scottish use]
mess around ;Vrb phrs. To engage in noncommittal sexual relations, often adulterously.
