;
;* Orig. meaning a condom, a contraceptive sheath.
scumbucket ;Noun. Meaning the same as 'scumbag'.
scummer;Noun. A person from Southampton. Derog. [Portsmouth use]
scundered;"Adj. To be embarrassed. E.g.""I was totally scundered when my girlfriend caught me playing with myself."" [Irish use]"
scunner;Noun. 1. A nuisance, an objectionable person. [Scottish use]
;2. Something objectionable or that's a nuisance. [Scottish use]
scunt;Noun. A contemptible person.
scupper;"Verb. To thwart, to prevent from succeeding. E.g.""Don't scupper your chances of passing your driving test by having a beer first."" {Informal}"
scut;Noun. A sexually promiscuous woman. [Merseyside use?]
scutch ;Verb. Sting or smart from a slap. [Runcorn/North-west use]
scutter;Noun. A slovenly woman. [Midlands use?]
scuzzbucket ;Noun. 1. A despicable or objectionable person.
;2. A sleazy person.
scuzzy ;Adj. Filthy, dirty, unkempt.
seconds out;Phrs. Usually stated by a third party, and jocularly announcing the imminent onset of trouble between two parties. From boxing.
see a man about a dog ;Vrb phrs. An euphemism to avoid telling of your true destination, often in reply to an awkward question. Is commonly used as a euphemism for going to the toilet.
seeing to ;"Noun. 1. A sexual act. E.g.""I wouldn't mind giving him a good seeing to, he's gorgeous."""
;2. A beating.
seen!;Exclam. OK! Understood! Right! [London use]
see one's arse;"Vrb phrs. To get upset, to lose one's temper. E.g.""You might want to avoid Dave for a few hours, he's seen his arse and is no mood to talk to anyone."" [Mainly Yorkshire use]"
see to;"Verb. To have sexual intercourse. E.g.""I was seeing to her when her mother arrived home."""
see you (!);"Vrb phrs./Exclam. Goodbye. Also as see ya. E.g.""Right, I'm off home, see you!"" {Informal}"
see you next Tuesday;Phrs. A veiled insult, working on the approximate creation of the acronym, CUNT. From See (C) you (U) next (N) Tuesday (T).
selfie;Noun. A photograph taken of oneself, often for use on social media. {Informal}
sell (someone) a pup ;"Verb. To deceive, to swindle, usually in a business transaction. E.g.""I brought a car from a back street dealer and was sold a pup. It broke down before I even got home."" {Informal}"
semi ;Noun. A half erect penis. An abb. of semi-erection. [1990s]
sen;"Pron. Self, or oneself. Usually in expressions such as yoursen, meaning yourself. E.g.""Did you carry that huge box all by yoursen?"" [Yorks use/dialect]"
send up;Noun. A parody, an act of mocking or satire. {Informal}
;"Verb. To mock, to parody, to make fun of. E.g.""He spent the evening sending up his guests, who then all left early."" {Informal}"
senga;Noun. A young, poorly educated female who wears casual sportswear and is of working class upbringing. The female equivalent of a 'ned'. Derog. Cf 'chav'. [Scottish/Glasgow use]
seppo;Noun. A person from the U.S.A.. Abbreviated and altered form of 'septic', see below.
septic ;Noun. A person from the U.S.A.. From the rhyming slang septic tank meaning Yank.
sesh;Noun. A period of drinking or drug taking. Abb. of session.
set of wheels ;Noun. A vehicle or a wheeled means of transport.
seven shades of shit;Noun. That which can be beaten out of someone, see 'beat seven shades of shit out of someone'.
sex on a stick;Noun. A slim, sexually attractive woman.
sex on legs;Noun. A sexually desirable person, usually applied to women.
sex wee;Noun. Ejaculate, semen.
shade;Adj. Unfair, questionable, disreputable, dubious. Probably from shady.
shaft ;Verb. 1. To fornicate. Male terminology. [1940s]
;2. To con, treat unfairly.
;Noun. The penis.
shag ;"Verb. 1. To copulate, to have sex. Less coarse than 'fuck'. E.g.""The first night we met we shagged all night."" [1800s]"
;"2. To wear out, to break. E.g.""You'll shag it up if you keep hitting it with that hammer."""
;Noun. 1. An act of fornication.
;"2. A hassle. E.g.""It's such a shag, having to get the early train; I'm not even usually awake at that time in the morning."""
;3. A term of address for a friend. [Staffordshire use]
shagbag;Noun. A sexually amenable or available woman. Derog.
shaggability;"Noun. A measure of a person's sexual desirability. Also shagability. E.g.""He had a general air of shaggability about him, he was truly gorgeous!"""
shaggable ;Adj. Sexually desirable. Also shagable.
shagged ;"Adj. Worn out, exhausted, broken. Also often combined with out or up. E.g.""I'm shagged out after my 26 mile run."""
shagging;Noun. Sexual intercourse.
shag out;"Verb. To wear out, to tire out. E.g.""He shagged out the engine by forgetting to top up the oil."""
;
shagtastic;Adj. 1. Sexually desirable, sexy.
;"2. Excellent, wonderful, by extension of meaning 1. E.g.""It was a shagtastic Ferrari."""
shake a leg! ;"Exclam. Hurry up! Move! E.g.""Come on you two, shake a leg! We have to get to the station before 6."""
shake hands with the unemployed;Vrb phrs. To urinate, male usage.
shake one's lettuce;"Vrb phrs. Of females, to urinate. E.g.""She got caught on CCTV shaking her lettuce behind a car."""
shambolic;Adj. In a mess, disorganised, chaotic, mismanaged. {Informal}
shan;Adj. Unfair. [North-east use]
;Verb. To embarrass. Also see 'shant' (verb). [Cumbria use]
shank;"Verb. To stab with a knife. E.g.""My mate got shanked outside the club by these drunken louts from out of town."""
Shanks's pony;"Noun. On foot, walking. E.g.""Looks like we've missed the bus, so it's Shanks's pony or wait another hour for the next bus."" {Informal}"
shant;Noun. A drink, usually alcohol, and especially beer.
;Verb. Embarrassed - past tense of 'shan'. [Cumbria use]
Sharon and Tracy ;Noun. A disparaging name for females considered to be working class, unintelligent and vulgarly dressed, generally below the social standards acceptable to the user of the phrase. Each name can be heard used individually to imply the same. Derog./Offens.
sharpish ;"Adj. Quickly. E.g.""You had better hurry to shops pretty damned sharpish, before they close"""
shart;"Verb. To break wind, from the anus, and to inadvertently defecate at the same time. A combination of the words 'shit' and 'fart'. E.g.""It was so embarrassing, I sharted in front of my mother-in-law."""
shat ;"Verb. To have defecated, the past tense of 'shit'. E.g.""I shat my pants when I saw the size of him, he was very scary."""
shattered;Adj. Worn out, exhausted. {Informal}
shaven haven;Noun. A depilated pubic region, usually of women, and viewed as sexually desirable.
Shaz /Shazza;Noun. A form of the name Sharon, see 'Sharon and Tracy'. Can be derog.
shed;Noun. Something dilapidated. Cf. 'shed on wheels'.
shedded ;Adj. Very intoxicated by alcohol or drugs.
shed load (of something) ;"Noun. A large quantity of (something). E.g.""If you want tunes on vinyl, go down Oldham Street, there's a shed load of record shops there."""
shed on wheels;Noun. A dilapidated vehicle. Cf. 'shed'.
sheepshagger ;Noun. A ruralised person. Derog.
sheesh!;"Exclam. Used to express exasperation, surprise. E.g.""Sheesh! That was a surprise, I never expected to win the lottery."" [Orig. U.S.]"
sheet;"Noun. Paper money, monetary notes. E.g.""My new computer cost me 800 sheets."""
shell out;"Verb. To pay up, to hand over, usually money. E.g.""I shelled out over £1000 for that holiday."" {Informal}"
sherbet ;"Noun. An alcoholic drink. Also sherbert. E.g.""I think we should go down to the bar, get in some sherbets and then hit a nightclub."""
sherbet (dab);Noun. A taxi. Rhyming slang on cab. (1990s?)
sherman;Noun. An act of masturbation. Cockney rhyming slang on sherman tank, rhyming with 'wank'. [1940s]
sheila;Noun. A woman. Stereotypical but jocular use when impersonating Australians and their vernacular. [Orig. Aust.]
shift;"Verb. 1. To move quickly. E.g.""You should have seen him shift when I told him they were giving away free beer downstairs."" {Informal}"
;"2. To consume large amounts of drink or food. E.g.""We shifted some beer last night."" {Informal}"
shift oneself;"Verb. A request to move oneself. Used in imper. E.g.""Will you shift yourself so I can vacuum the lounge."" {Informal}"
shift one's arse;"Vrb phrs. To move out of the way or to hurry up. E.g.""Come on, shift your arse and help me tidy up, my parents will be here soon."""
shirt ;Noun. A male nightclubber whose ideal night out will be to drink excessively, make sexual advances towards women and complete the night with a drunken brawl. Invariably their attire includes a dressy shirt, often without a tie.
shirtlifter ;Noun. A homosexual male. Derog.
shirty;"Adj. Ill-tempered. E.g.""Pete got all shirty with me when I didn't invite him for dinner."" {Informal}"
shit (!) ;"Noun. 1. Faeces. E.g.""OK, who's got shit on their shoes?"" [1500s]"
;"2. An act of defecation. E.g.""I'll be with you in 5 minutes, I just need to have a shit and clean my teeth."""
;"3. A contemptible or obnoxious person. E.g.""He's an irritating little shit who doesn't know when to shut up."" [1500s]"
;4. Rubbish, nonsense, a bad thing, something worthless. [Late 1800s]
;5. Cannabis or marijuana.
;"6. Miscellaneous items. E.g.""Come on, get your shit together, the taxi's due in 5 minutes."""
;"Verb. To defecate. E.g.""I do my best thinking when I'm on my own, actually usually when I'm shitting."""
;Exclam. An exclamation of frustration or anger.
shit-a-brick! ;Exclam. An exclamation of surprise or annoyance.
shit-all ;Adj. Nothing at all. Cf. 'fuck-all', 'sod-all'.
shitbag ;Noun. A contemptible or obnoxious person.
shitbox;Noun. 1. The anus.
;2. A contemptible thing, place or person.
shit bricks ;Vrb phrs. To be terrified, very scared. Cf. 'shit one's pants' and 'brick it'.
shitcunt;Noun. A contemptible, worthless person. Also shit-cunt.
shite ;Noun / Verb. See 'shit'. [Orig. Northern use. 1800s]
shit eater;Noun. A contemptible person. Also shiteater.
shitehawk;Noun. 1. A despicable person.
;2. A seagull.
shitepipe;Noun. The anus. [Mainly Scottish/Northern use]
shiter;Noun. The anus. A variation on 'shitter' (noun 1).
shitey ;Adj. See 'shitty'.
shitface ;Noun. A contemptible person. Also shit-face.
shitfaced ;Adj. 1 Drunk, intoxicated. [1940s]
;2. Intoxicated with drugs.
shit for brains ;Noun. A particularly stupid person, a contemptible person.
shithead ;Noun. An contemptible person. Also shit-head.
shit heap;Noun. An object or place that's dirty, unsightly, unreliable, of poor quality. Cf. 'heap of shit'.
shit hits the fan ;"Phrs. As 'when the shit hits the fan', it warns that severe consequences will be felt when the results of actions are discovered. Alternatively, in such phrases as ""the shit will hit the fan when she discovers Ibroke her favourite vase"". See 'when the shit hits the fan'."
shit-hot ;Adj. Excellent, the best, extremely good. Also shit hot.
shithouse ;Noun. A messy or dirty domicile. Originally a shithouse was an externally accessed toilet, before the advent of an inside lavatory.
shit kicker;Noun. A rural person, usually a farm worker. Also shitkicker. [Orig U.S.?]
shitless;Adj. Very frightened. Usually preceded by the word bored or scared. See 'scared shitless' and 'bore shitless'.
shit load (of something) ;"Noun. Many, a large number of. Also shitload. E.g.""It was a great New Year party - there was shit loads of free wine and some really lovely people."""
shitloads;Adj. A large amount.
shitlist;"Adj. A list, albeit frequently hyperthetical, of people or places one finds unacceptable or unpopular. E.g.""He's on my shitlist after cheating on my sister."""
shit on a raft;Noun. A meal, specifically kidneys on toast. [Navy use]
shit on a stick (!);Exclam. Expression of surprise.
;"Noun. Something, or someone, important or exceptional. E.g.""Go buy that new tune, it really is shit on a stick."""
shit one's pants ;"Vrb phrs. To be terrified. Used metaphorically for when in extreme terror the bowels are uncontrollably voided. E.g.""He was shitting his pants when he heard the police had warrant out for his arrest."""
shit on (someone) ;"Verb. To betray, to land someone in trouble. E.g.""I know it was you who shitted on him, so don't pretend you're his best friend"""
shit out ;"Verb. To act cowardly, to change one's mind out of fear. E.g.""They shitted out of coming once they saw the weather forecast."""
shits ;"Noun. Diarrhoea. E.g.""I can't come out to the pub, I've got the shits."""
shit-scared ;Adj. Very frightened. Cf. 'shit bricks'.
shitshow ;Noun.A disasterous and disorganised event or situation.
shit (somone);"Verb. To deceive or tease. E.g.""Are you shitting me? Or is that the truth?"""
shit-stabber ;Noun. A homosexual male. Derog.
shitstain ;Noun. A contemptible person. Also as shit-stain. Derog.
shit stirrer ;Noun. An insidious gossip, a person whose malicious words and actions cause problems for others.
shit stirring;Noun. Trouble making, for the sake of it.
shit stoppers;Noun. 1. Very narrow, tight fitting jeans. [North use]
;2. Tracksuit (sweatsuit) bottoms with elasticated ankles. [North use]
shitstorm;Noun. A confused, frightening or controversial situation. [Orig U.S.]
shitter ;Noun. 1. The anus.
;2. A toilet.
;3. A contemptible person.
shit the bed!;Exclam. An exclamation of surprise.
shit ticket;Noun. Toilet paper.
shitting *;"Adj. 1. A general intensifier. E.g.""Did you see the shitting size of that man."""
;"2. A general term of abuse. E.g.""When shitting lawyers charge you a fortune for a consultation only to then say they don't think you have case."""
;Also as shiteing.
shitting hell! ;Exclam. An exclamation of surprise, annoyance or frustration. Almost invariably it'll be heard pronounced shittin'ell!
shit-tip;"Noun. A mess. E.g.""Tommy, you're not going to Macdonalds until you tidy your bedroom, it's a bloody shit-tip!"""
shitty ;Adj. 1. Worthless, trashy.
;2. Covered in faeces or excrement.
;3. Dirty, filthy.
;4. Contemptible, despicable.
;"5. Uncomfortable, unpleasent. E.g.""We had a shitty night's sleep."""
;"6. Insignificant, trivial. E.g.""It was a shitty little car that could only seat 4 people, and uncomfortably at that."""
shit up;"Verb. To terrify, to scare. E.g.""I was so shitted up I had to sleep with my bedroom light on."""
shizzle my nizzle! ;Exclam. For sure, certainly, without doubt. Cf. 'fo' shizzle!'. [Orig. U.S./black]
shlepp ;Verb. See 'schlep'.
shock horror! ;Exclam. That's not surprising. An ironic exclamation.
shonky;Adj. Dubious, unreliable, underhand. [Orig. Aust./N.Z.]
shoogle;Verb. To shake gently, to shake off, to joggle, to move back and forth. [Mainly Scottish use]
shoot! ;Exclam. A euphemism for 'shit'. [Orig. U.S.]
shoot blanks ;Verb. Of a man, to be sterile. Cf. 'fire blanks'.
shoot off;"Verb. To leave quickly, to hurriedly go. E.g.""I'm just going to shoot off down to the post office before it closes."""
shoot one's load ;"Vrb phrs. To ejaculate semen. E.g.""He shot his load all over her chest and expected her to like it."" [1800s]"
shoot one's wad;"Vrb phrs. To ejaculate semen. E.g.""I was furious! He shot his wad and then immediately fell asleep on top of me."""
shoot-up ;Verb. To inject a drug.
shop ;"Verb. To tell or inform on. E.g.""I shopped him to the police and he got sent down for 5 years."" [1890s]"
shopping ;Noun. 1. A euphemism for illicit drugs as brought from a drug dealer.
;2. Shoplifting. [Criminal use]
short and curlies ;Noun. Basically the term refers to pubic hairs, however it is used figuratively in having got someone by the short and curlies - having complete power over someone. Orig military use. [1930s]
short-arse ;Noun. A person who is small in stature. Derog.
shot ;Adj. Worn out, exhausted. {Informal}
shotgun;Verb. A way of smoking cannabis/marijuana between two people, with one person blowing and the other inhaling.
shoulda ;"Verb. Should have. Also as shouldda. E.g.""We shoulda gone on the other road, via the bypass, it's quicker."" {Informal}"
shout ;"Noun. A round of drinks. E.g.""Go on, get to the bar you lazy sod, it's your shout."""
shout-out ;Noun. A mentioning of a person verbally or in writing, as a method of showing respect. Often heard used on the radio by DJ's replacing the previously popular request. [1990s]
shout the odds ;"Vrb phrs. To aggressively and verbally express one's opinions. E.g.""Coming in here, shouting the odds and expecting everyone to like you! What an idiot!"" {Informal}"
shovel (and pick);Noun. Prison. Rhyming slang on 'nick' (noun 2).
shove it! ;Exclam. A dismissive exclamation of anger.
shove it up your arse!;Exclam. An exclamation of contempt.
shove off (!) ;Verb. Go away. Often heard as an imperative exclamation.
showboat ;Verb. To show off, to ostentatiously display one's skills. {Informal}
showboating ;Noun. Showing off, pretentiously displaying one's skills and abilities. {Informal}
shower ;Noun. A derogatory and all encompassing term for a contemptible person(s). An abbreviated form of 'shower of shite'.
shower of shite/shit;"Noun. Contemptible worthless person, persons or things. E.g.""It has been said that this dictionary is a shower of shit."""
shrammed;Adj. Cold, frozen. Also occasionally numbed by extension of being frozen. [South-west use/dialect]
shrapnel ;Noun. Money in the form of loose change, not notes.
shreddies ;Noun. Underwear.
shrimp ;"Verb. To lick, suck and kiss the toes for sexual gratification. E.g.""I dont know how people can be into shrimping, imagine how smelly people's feet get."""
;Noun. A small, thin, feeble and objectionable person. Cf. 'prawn'.
shrooms ;Noun. Mushrooms, often with regard to 'magic mushrooms', the hallucinogenic psilocybin. Cf. 'mushies'.
shufflebutt ;Noun. A fidgety, restless person.
shufty ;"Noun. A look, a glance. Also shufti and shoofty. Derived from the Arabic sufti, meaning have you seen. E.g.""Have a shufty at the copyright laws before you think about using this slang dictionary on your own website."" [1940s] {Informal}"
shut it! ;Exclam. Be quiet! Shut up!
shut your face!;"Exclam. Shut your mouth! Shut up! Be quiet! There are several variations, including shut your gob, shut your trap, shut your cake-hole and shut your pie-hole. E.g.""If you don't shut your gob I'll shut it for you!"""
sick!;Exclam. Excellent! Good!
sick as a parrot ;Phrs. Depressed, upset, very disappointed.
sickie ;Noun. A period away from work with illness, and usually without just medical cause. Cf. 'throw a sickie'. [Orig. Aust./N.Z.] {Informal}.
sicko ;Noun. A disturbing and unstable person, a pervert. Derog.
side;"Noun. Boastfulness, arrogance. Usually in negative, e.g.""He's a nice man, honest and down to earth, and there's no side to him."" {Informal}"
sign one's pants;"Vrb phrs. To urgently need to defecate. E.g.""Quick! Let me in the toilet will you! I've just signed my pants."""
sike;"Noun/Verb. Alternative spelling of psyche, as in psyche out. E.g.""He was really siked out by my staring at him all night."""
sile down;"Verb. To rain heavily. From sile meaning sieve. E.g.""You'll need an umbrella, it's siling down out there."" [Yorks/Lincs use]"
silent but deadly;Phrs. Describing the silent emmision of wind from the anus, a 'fart', that is particularly bad smelling. Cf. S.B.D. [1960s]
silent but violent;Phrs. The same as 'silent but deadly', see above.
silly billy;Noun. Affectionate name for a foolish person.
silly bugger;Noun. An idiot, a fool. Cf. 'play silly beggars/buggers'.
silly cow;Noun. A foolish woman. See 'cow' (noun 1). Cf. 'silly moo'.
silly moo ;Noun. A foolish woman. Often jocular use. Cf. 'silly cow'.
silly sausage;Noun. A foolish person. Jocular but affectionate usage.
single fish;Noun. An act of urination. Rhyming slang on 'pish', meaning 'piss'. [Scottish use]
siphon the python ;Vrb phrs. Of males, to urinate. Also 'syphon the python'.
sissy ;Noun. An effeminate, weak, or cowardly person. Derog. {Informal}
sister;Noun. 1. A term of address between women.
;2. A term of address for a black woman. [Black use]
sitter;Noun. In sport, an easy catch or goal, that results in points being scored, a certainty. {Informal}
six-pack ;Noun. Strong and evident abdominal muscles. [Orig. U.S.]
sixpence short of a shilling;Phrs. Crazy, eccentric.
sixty-nine (69);Noun. A couple's simultaneous oral stimulation of each others genitals during sex. Being representative of the shape two bodies are in such a position.
;"Verb. To have oral sex in the manner of the noun, above. E.g.""It was a wild party, there was a couple sixty-nining each other in the garden."""
size queen ;Noun. A gay male with a sexual preference for partners with large genitalia.
skag ;Noun. Heroin. Also spelt 'scag'.
skaghead;Noun. A heroin addict. Derog. See 'skag'.
skanger;Noun. A young, working class person who dresses in casual sportswear. Cf. 'chav'. [Irish/Dublin use]
skank;"Verb. To steal, thieve. E.g.""Someone's skanked my cigarettes and it was nearly a full packet!"""
;"Noun. Someone or something disgusting, or unpleasant. E.g.""He's a bit of a skank, not washing for 5 days and then expecting Debbie to sleep with him."""
skanky ;Adj. Dirty, unnattractive, ugly, smelly.
skanky pants;Noun. Dirty, or disgusting, lingerie or underwear. Also occasionally skanky panties, but this is more U.S..
skate;Noun. A person from Portsmouth. Derog. [Mainly Southampton use]
skedaddle ;Verb. Move, go away. {Informal}
skeen;Exclam. O.K.! Understood! [London use/2000s?]
skeg;"Noun. A look at. E.g.""Give us a skeg at your paper, I need to check the racing results."" (Hull/Yorkshire use)"
skelf;Noun. A splinter. [Scottish/N.Irish use]
skerret ;Noun. A tiny amount, a fragment. A derivative of 'skerrick'.
skerrick;"Noun. A small amount, a fragment. E.g.""Would you believe it, it was a wedding but we didn't get a skerrick to eat and went home starving."" Cf. 'skerret'. [Early 1800s]"
sket;Noun. A promiscuous woman. Derog. (South-east use)
skew-whiff ;Adj. Out of alignment, incorrect. {Informal}
-ski;"Suffix. Added to a word to humourously imitate a Russian word. Also as sky. E.g.""Right I'm offski before my I miss my buski."""
skid-lid;Noun. A motorcycle helmet. Also skidlid.
skidmark ;Noun. A faecal smear or stain. Frequently with regard to one's undergarments. [1900s]
skids;Noun. 1. Underwear, underpants, knickers.
;2. Excrement smears or stains, usually with respect to one's underpants. Abb. of 'skidmark'.
skin ;Noun. 1. A skinhead.
;2. A sister. Rhyming slang on 'skin and blister'.
;Verb. To roll up a cannabis/marijuana cigarette. Abb. of 'skin up'.
skin and blister;Noun. Sister. Cockney rhyming slang.
skin diver;Noun. A five pound (sterling) note. Rhyming slang on 'fiver'.
skin flute;Noun. The penis.
skinful ;"Noun. A sufficient quantity of alcohol to make one drunk. E.g.""I'm not driving anywhere; I've had a skinful and the police are out in force."" {Informal}"
skinny;"Noun. Information, details. E.g.""What's the skinny with that new man in accounts?"""
skins ;Noun. Cigarette papers, often referring to those used in the construction of a 'joint'.
skint ;Adj. Having no money, poor.
skin up ;"Verb. To roll or build a cannabis/marijuana cigarette. E.g.""Anyone who was spotted skinning up was arrested and given a police warning."""
skirt ;Noun. A woman or women. Cf. 'bit of skirt'. Derog.
skit;Verb. To make fun of, to tease. [Merseyside use]
skitters;"Noun. A bout of diarrhoea. E.g.""I'm not coming into work today, I've got the skitters."""
skive;Noun. An evasion of one's tasks and responsibilities, a period of shirking.
;"Verb. To evade doing one's work or duties, to truant. E.g.""Every Friday afternoon you can guarantee he'll be skiving and getting drunk down the pub."""
skive off;"Verb. Meaning the same as 'skive' (verb). E.g.""There's nothing clever about skiving off from school"""
skiver;Noun. A shirker, one who evades doing their work or duties.
skivvies ;Noun. Underwear, particularly with reference to pants. [Orig. U.S.]
skivvy ;Noun. A servant for menial tasks. Derog. {Informal}
;
skoosh *;Noun. 1. A squirt of cream from an aerosol.
;"2. Something very easy. E.g.""That exam was a skoosh! I knew all the answers."""
;3. A carbonated drink.
;* All uses are Scottish.
skrike;Verb. See 'scrike'.
skullfuck;Verb. To actively perform sexual intercourse with a person using their mouth. [Orig U.S.]
skun;"Verb. Past tense of 'skin' (verb), i.e. skinned. E.g.""Rob skun up a joint last night that was 9 inches long!"""
skunk ;Noun. 1. A popular type of very strong marijuana, characterized by its pungent smell, hence its name.
;2. A person from Newcastle-upon-Tyne, and more particularly a supporter of Newcastle football club. From the team's colours, black and white stripes, and as a derogatory term due to the fact that skunks 'smell'. Derog. [Mainly Sunderland use]
skunkweed;Noun. A type of very strong marijuana. See 'skunk'.
sky (rocket);Noun. Pocket. Rhyming slang. [Late 1800s]
skypilot;Noun. A priest, vicar or similar preacher of religion.
slag ;Noun. 1. A prostitute or promiscuous woman. Also occasionally heard with reference to such men. Derog.
;2. A contemptible person.
;Verb To put down, verbally. Meaning the same as 'slag off'.
slag (someone) off;"Verb. To verbally put down someone or something. E.g.""If you are going to persistently slag off your friends you soon won't have any left to upset."""
slag tag;Noun. A tattoo located at the base of the spine, usually spread across the width of the back and often tribal in style. Cf. 'tramp stamp'.
slam dancing ;Adj. An aggressive and physical dance style adopted by thrash metal fans, originating with second generation punks in the early 1980s. Cf. 'moshing'.
slap ;Noun. Cosmetic make-up. Originally from theatrical usage. See 'slap-up' (verb).
;"Verb. To beat-up, hit, thump. E.g.""I'm going to slap that bastard if he doesn't shut up."""
slap and tickle ;Noun. Playful sexual activity. {Informal}
slaphead ;Noun. A balding person.
slapper ;Noun. 1. A sexually promiscuous woman. Derog.
;2. A contemptible woman.
